{
  "$schema": "https://json-schema.org/draft/2020-12/schema",
  "$id": "https://raw.githubusercontent.com/ddadda69/GPT_DUDAS/main/PLUGIN/plan-viewer-plugin/contracts/plan.schema.json",
  "title": "Plan Viewer Plugin Plan",
  "type": "object",
  "additionalProperties": false,
  "required": ["id", "version", "title", "sections"],
  "properties": {
    "$schema": { "type": "string" },
    "id": {
      "type": "string",
      "minLength": 1,
      "maxLength": 128,
      "pattern": "^[A-Za-z0-9][A-Za-z0-9._-]{0,127}$"
    },
    "version": { "type": "integer", "minimum": 1 },
    "title": { "type": "string", "minLength": 1 },
    "description": { "type": "string" },
    "sections": {
      "type": "array",
      "minItems": 1,
      "items": { "$ref": "#/$defs/section" }
    }
  },
  "$defs": {
    "option": {
      "type": "object",
      "additionalProperties": false,
      "required": ["id", "text"],
      "properties": {
        "id": { "type": "integer", "minimum": 1, "maximum": 2 },
        "text": { "type": "string", "minLength": 1 },
        "recommended": { "type": "boolean" }
      }
    },
    "section": {
      "type": "object",
      "additionalProperties": false,
      "required": ["id", "title", "options", "defaultOption"],
      "properties": {
        "id": {
          "type": "string",
          "minLength": 1,
          "maxLength": 128,
          "pattern": "^[A-Za-z0-9][A-Za-z0-9._-]{0,127}$"
        },
        "title": { "type": "string", "minLength": 1 },
        "description": { "type": "string" },
        "options": {
          "type": "array",
          "minItems": 1,
          "maxItems": 2,
          "items": { "$ref": "#/$defs/option" }
        },
        "defaultOption": { "type": "integer", "minimum": 1, "maximum": 2 },
        "allowOther": { "type": "boolean" },
        "allowNote": { "type": "boolean" },
        "noteLabel": { "type": "string" },
        "notePlaceholder": { "type": "string" }
      }
    }
  }
}
