{
  "$schema": "https://ddadda69.github.io/GPT_DUDAS/data/schema.json",
  "id": "ejemplo-cache-api-consultas-2026-08-25",
  "version": 2,
  "title": "Ejemplo: añadir caché a una API de consultas",
  "description": "Plan ilustrativo para reducir la latencia y la carga sobre la base de datos sin cambiar el contrato público de la API. El objetivo del ejemplo es mostrar cómo Plan Viewer presenta una **decisión real** y conserva el resto del plan completo en Markdown.",
  "sections": [
    {
      "id": "arquitectura-cache",
      "title": "1. Elegir la arquitectura de caché",
      "description": "Esta decisión cambia de forma importante la implementación y la operación, por lo que se presentan dos alternativas reales.",
      "defaultOption": 1,
      "options": [
        {
          "id": 1,
          "recommended": true,
          "text": "**Redis compartido — recomendado para producción.** Todas las instancias de la API leen y escriben en la misma caché, por lo que una respuesta almacenada se reutiliza aunque la siguiente petición llegue a otro servidor.\n\nVentajas:\n\n- Comportamiento consistente al escalar horizontalmente.\n- TTL e invalidación centralizados.\n- Métricas y límites independientes del proceso de la API.\n\nConsecuencias:\n\n- Añade una dependencia de infraestructura y credenciales.\n- La API debe tolerar que Redis falle: ante un error, consulta la base de datos y responde normalmente.\n- Conviene definir límites de memoria y una política de expulsión, por ejemplo `allkeys-lru`."
        },
        {
          "id": 2,
          "text": "**Caché en memoria dentro de la API.** Cada instancia conserva sus propias entradas mediante una caché LRU. Es adecuada para un despliegue sencillo con una sola instancia o para una primera prueba local.\n\nVentajas:\n\n- No requiere servicios externos.\n- Implementación y operación más simples.\n\nConsecuencias:\n\n- Las instancias no comparten datos y pueden devolver resultados con distinta antigüedad.\n- La caché desaparece al reiniciar el proceso.\n- El consumo de memoria compite con el resto de la aplicación.\n\nSi la API va a ejecutarse con varias réplicas, esta opción debería considerarse temporal."
        }
      ],
      "allowOther": false,
      "allowNote": true,
      "notePlaceholder": "Añade aquí una restricción de infraestructura o una preferencia…"
    },
    {
      "id": "contrato-cache",
      "title": "2. Definir el comportamiento de la caché",
      "defaultOption": 1,
      "options": [
        {
          "id": 1,
          "recommended": true,
          "text": "Aplicar el patrón **cache-aside** sin modificar los códigos, cabeceras ni cuerpos de respuesta existentes.\n\n1. Construir una clave estable con la versión del esquema, el endpoint, el usuario o tenant autorizado y los parámetros normalizados.\n2. Consultar la caché antes de acceder a la base de datos.\n3. Si existe una entrada válida, deserializarla y devolver exactamente la misma respuesta pública.\n4. Si no existe, ejecutar la consulta, guardar únicamente respuestas correctas y devolver el resultado.\n\nReglas iniciales:\n\n- TTL predeterminado: **5 minutos**, configurable mediante `CACHE_TTL_SECONDS`.\n- No almacenar errores, respuestas parciales ni datos que el solicitante no pueda volver a consultar.\n- Incluir un prefijo de versión, por ejemplo `queries:v1:`, para invalidar el formato completo sin recorrer claves.\n- Cuando una operación modifique datos, eliminar las claves afectadas; si no es posible determinar cuáles son, usar un TTL corto hasta introducir invalidación por etiquetas.\n- Si la caché no está disponible, continuar contra la base de datos y registrar el fallo sin afectar al usuario."
        }
      ],
      "allowOther": false,
      "allowNote": true
    },
    {
      "id": "implementacion",
      "title": "3. Implementar por capas",
      "defaultOption": 1,
      "options": [
        {
          "id": 1,
          "recommended": true,
          "text": "Separar la integración en componentes pequeños para que la lógica del endpoint no dependa directamente del proveedor elegido.\n\n- Crear una interfaz `CacheStore` con operaciones `get`, `set` y `delete`.\n- Implementar `RedisCacheStore` o `MemoryCacheStore` según la decisión anterior.\n- Añadir un servicio `CachedQueryService` que genere claves, aplique TTL y recurra al repositorio existente cuando haya un fallo de caché.\n- Inyectar el servicio en los endpoints de lectura seleccionados.\n- Mantener la caché desactivable con `CACHE_ENABLED=false` para facilitar el despliegue y la reversión.\n\nFlujo simplificado:\n\n```text\npetición -> clave normalizada -> buscar en caché\n                               | hit  -> devolver respuesta\n                               | miss -> consultar BD -> guardar -> devolver\n                               | error de caché -> consultar BD -> devolver\n```\n\nEmpezar con un único endpoint de alto volumen. Tras verificar métricas y consistencia, extender el patrón al resto de consultas aptas."
        }
      ],
      "allowOther": false,
      "allowNote": true
    },
    {
      "id": "pruebas-observabilidad",
      "title": "4. Verificar rendimiento y corrección",
      "defaultOption": 1,
      "options": [
        {
          "id": 1,
          "recommended": true,
          "text": "Cubrir el comportamiento funcional, los fallos y el efecto medible antes de ampliar el uso.\n\n| Área | Comprobación |\n|---|---|\n| Pruebas unitarias | Hit, miss, TTL, clave normalizada y serialización |\n| Integración | Redis disponible, caído y con datos corruptos |\n| Seguridad | Separación por usuario/tenant y ausencia de datos sensibles en las claves |\n| Compatibilidad | Respuestas idénticas con caché activada y desactivada |\n| Carga | Latencia p50/p95 y consultas por segundo antes y después |\n\nAñadir métricas `cache_hit`, `cache_miss`, `cache_error` y duración de la consulta a base de datos. El objetivo inicial será aumentar progresivamente la tasa de aciertos sin elevar errores ni servir datos fuera del TTL acordado. Los logs no deben incluir valores sensibles ni el contenido completo almacenado."
        }
      ],
      "allowOther": false,
      "allowNote": true
    },
    {
      "id": "despliegue-reversion",
      "title": "5. Desplegar de forma gradual y reversible",
      "defaultOption": 1,
      "options": [
        {
          "id": 1,
          "recommended": true,
          "text": "Desplegar primero con `CACHE_ENABLED=false`, comprobar conectividad y activar la caché solo para el endpoint piloto. Durante la primera ventana de observación, comparar latencia, tasa de errores, consultas a base de datos y uso de memoria.\n\nCriterios de finalización:\n\n- El contrato público de la API no cambia.\n- Un fallo del proveedor de caché no impide responder.\n- Las pruebas de aislamiento y expiración pasan.\n- La reducción de consultas a base de datos es visible en métricas.\n- La operación queda documentada, incluidas configuración, invalidación y diagnóstico.\n\nLa reversión consiste en establecer `CACHE_ENABLED=false`; no requiere deshacer el despliegue ni borrar inmediatamente las entradas, porque dejan de consultarse y caducan por TTL."
        }
      ],
      "allowOther": false,
      "allowNote": true
    }
  ]
}
