{
  "$schema": "https://ddadda69.github.io/GPT_DUDAS/data/schema.json",
  "id": "plan-viewer-plugin-mcp-20260825-1129-k7m4",
  "version": 1,
  "title": "Siguiente nivel de Plan Viewer: plugin embebido en la conversación",
  "description": "Evolucionar Plan Viewer desde un visor web externo hacia un plugin de ChatGPT con servidor MCP y UI MCP Apps embebida, manteniendo la robustez y el aislamiento por plan que ya tiene la versión web.",
  "sections": [
    {
      "id": "arquitectura-plugin",
      "title": "1. Convertir Plan Viewer en un plugin MCP con UI embebida",
      "description": "La documentación actual de OpenAI permite que un plugin combine skills, un servidor MCP y UI opcional. Para Plan Viewer, la UI es especialmente adecuada porque el usuario necesita inspeccionar, comparar, editar y confirmar información estructurada.",
      "defaultOption": 1,
      "options": [
        {
          "id": 1,
          "recommended": true,
          "text": "**Arquitectura híbrida — recomendada.** Crear un plugin compuesto por la skill de Plan Viewer, un servidor MCP y una UI MCP Apps que se renderice dentro de ChatGPT. La experiencia principal en ChatGPT pasa a ser el componente embebido, mientras que el Viewer web actual se conserva como superficie portátil y de respaldo para Codex, depuración y enlaces permanentes.\n\nEl servidor MCP será la fuente de herramientas y validación; la UI recibirá el plan como `structuredContent` y se asociará al tool mediante `_meta.ui.resourceUri`. El componente se servirá como recurso `text/html;profile=mcp-app`.\n\n**Ventajas:**\n\n- El usuario decide y edita sin abandonar la conversación.\n- ChatGPT puede seguir el flujo inmediatamente después de recibir las decisiones.\n- El mismo tool sigue siendo útil en clientes que no rendericen UI, como exige la arquitectura recomendada por OpenAI.\n- No se pierde el Viewer web ya endurecido ni los enlaces `?plan=<id>`.\n- Permite migrar gradualmente y comparar la fiabilidad del plugin con la versión estática antes de retirar nada.\n\n**Resultado esperado:** pedir un plan invoca el plugin, aparece Plan Viewer dentro de la conversación y el enlace web queda como fallback, no como flujo principal."
        },
        {
          "id": 2,
          "text": "**Plugin como única interfaz.** Implementar la misma arquitectura MCP + UI, pero retirar GitHub Pages y el Viewer web cuando el plugin funcione.\n\nReduce superficies y mantenimiento a largo plazo, pero obliga a que toda la experiencia dependa del host que soporte MCP Apps UI y elimina un mecanismo muy útil para depuración, portabilidad y uso fuera de ChatGPT. Solo elegiría esta variante después de varias semanas de uso estable del plugin."
        }
      ],
      "allowOther": true,
      "allowNote": true
    },
    {
      "id": "contrato-tools",
      "title": "2. Separar presentación del plan y devolución de decisiones",
      "description": "El punto clave no es solo mostrar el formulario dentro del chat, sino hacer que lo seleccionado vuelva al modelo de forma estructurada y validada.",
      "defaultOption": 1,
      "options": [
        {
          "id": 1,
          "recommended": true,
          "text": "**Dos tools — recomendado:** `present_plan` y `submit_plan_decisions`.\n\n`present_plan`:\n- recibe el JSON completo del plan;\n- lo valida con el mismo contrato de Plan Viewer;\n- guarda/publica el snapshot cuando proceda;\n- devuelve `structuredContent` con `id`, `version`, título y secciones;\n- está enlazado al recurso UI mediante `_meta.ui.resourceUri`, por lo que ChatGPT muestra el Viewer embebido.\n\n`submit_plan_decisions`:\n- recibe `planId`, `version` y una decisión por sección;\n- admite opción elegida, `No implementar`, `Otra`, contenido editado y nota;\n- rechaza IDs/versiones que no coincidan con el plan mostrado;\n- devuelve un objeto estructurado y un resumen textual visible para el modelo.\n\nLa UI llama `submit_plan_decisions` mediante `tools/call`. Así el resultado no depende del portapapeles: el servidor valida la respuesta y el modelo recibe un resultado estructurado que puede aplicar en el mismo flujo.\n\nMantendría `ui/message` únicamente para solicitar explícitamente un nuevo turno conversacional cuando sea útil, no como canal principal de datos."
        },
        {
          "id": 2,
          "text": "**Un único tool de presentación + `ui/message`.** `present_plan` renderiza el componente y, al confirmar, la UI genera el mismo texto que hoy copia Plan Viewer y lo envía como mensaje de seguimiento.\n\nEs más pequeño para un prototipo, pero el resultado queda menos tipado y obliga al modelo a reinterpretar texto que ya teníamos estructurado. También desplaza validación importante al cliente. Es válido para una prueba muy rápida, pero no lo elegiría como arquitectura definitiva."
        }
      ],
      "allowOther": true,
      "allowNote": true
    },
    {
      "id": "componente-ui",
      "title": "3. Rehacer la interfaz como componente MCP Apps sin duplicar lógica",
      "defaultOption": 1,
      "options": [
        {
          "id": 1,
          "recommended": true,
          "text": "Crear un pequeño proyecto TypeScript/React separado del servidor, siguiendo la separación recomendada por OpenAI (`server/` y `web/`). El componente recibirá siempre el último resultado de tool por `ui/notifications/tool-result` y tratará `structuredContent` como entrada no confiable.\n\nLa lógica se dividirá en tres capas reutilizables:\n\n1. **Contrato puro:** tipos, validación del plan y validación de decisiones, sin DOM ni React.\n2. **Estado de decisión:** opción seleccionada, edición Markdown, `Otra` y nota. Es estado efímero del componente; puede sincronizarse con `ui/update-model-context` cuando el modelo deba conocer cambios todavía no enviados.\n3. **Render:** cards, radios, editor Markdown y confirmación.\n\nNo usaría `localStorage` para datos del plan. OpenAI recomienda que los datos autoritativos vivan en servidor/servicio y que el estado de UI sea efímero; si más adelante necesitamos persistencia entre conversaciones se añadirá almacenamiento server-side.\n\nEl Viewer web puede reutilizar el mismo contrato y tests aunque tenga un render distinto, evitando que vuelvan a divergir schema, navegador y plugin."
        }
      ],
      "allowOther": false,
      "allowNote": true
    },
    {
      "id": "persistencia",
      "title": "4. Mantener GitHub como almacenamiento inicial del plugin",
      "description": "El plugin necesita decidir dónde viven los planes una vez que el UI ya no depende directamente de GitHub Pages.",
      "defaultOption": 1,
      "options": [
        {
          "id": 1,
          "recommended": true,
          "text": "**GitHub como backend inicial — recomendado.** Mantener `data/plans/<id>.json` como fuente de verdad y `current.json` como espejo del último plan, pero mover todas las lecturas/escrituras al servidor MCP. La UI nunca tendrá credenciales ni escribirá GitHub directamente.\n\nEl servidor conserva la protección actual:\n- verificación de identidad/autorización;\n- creación exclusiva de IDs nuevos;\n- actualización con SHA esperado;\n- `id` y `version` estrictos;\n- conflicto explícito si otro proceso cambia el mismo plan;\n- actualización de `current.json` únicamente como espejo no canónico.\n\nEsto aprovecha el sistema que ya está funcionando y mantiene los planes inspeccionables y restaurables."
        },
        {
          "id": 2,
          "text": "**Persistencia propia del servidor.** Guardar planes y decisiones en SQLite/PostgreSQL u otro almacenamiento controlado por el MCP server, usando GitHub solo como código y backup.\n\nTiene más sentido si Plan Viewer acaba teniendo muchos usuarios, búsqueda, historial de decisiones, permisos por usuario o miles de planes. Para uso personal añade despliegue, backups, autenticación y migraciones sin resolver ahora un problema real."
        }
      ],
      "allowOther": true,
      "allowNote": true
    },
    {
      "id": "entrega-pruebas",
      "title": "5. Implementarlo por fases con pruebas de conversación reales",
      "defaultOption": 1,
      "options": [
        {
          "id": 1,
          "recommended": true,
          "text": "Haría la migración en una rama nueva, sin tocar el flujo web estable hasta que el plugin pase pruebas reales.\n\n**Fase 1 — núcleo MCP**\n- Crear `present_plan` y `submit_plan_decisions`.\n- Reutilizar el schema actual y añadir un schema formal para la respuesta del usuario.\n- Probar ambos tools sin UI para garantizar que ChatGPT/Codex pueden completar el flujo solo con herramientas.\n\n**Fase 2 — UI embebida**\n- Registrar el recurso MCP Apps y asociarlo a `present_plan`.\n- Implementar radios, edición Markdown, `Otra`, nota y botón de confirmación.\n- Hacer que confirmar llame `submit_plan_decisions`.\n- Devolver al modelo tanto `structuredContent` como un resumen compacto.\n\n**Fase 3 — integración con la skill**\n- La skill deja de construir un enlace como mecanismo principal y llama al tool del plugin.\n- Conserva la regla de escribir el plan completo también en la conversación.\n- Cuando no haya UI disponible, el tool y la respuesta textual siguen siendo suficientes.\n\n**Fase 4 — pruebas**\n- Dos chats simultáneos con planes distintos.\n- Dos chats intentando actualizar el mismo `id`.\n- Edición de Markdown, `Otra`, `No implementar` y notas.\n- Recarga/reapertura de una conversación.\n- Cliente sin UI.\n- Fallo de GitHub/MCP y recuperación sin pérdida del plan.\n\n**Criterio para darlo por terminado:** desde una conversación se puede pedir un plan, decidir dentro del componente y recibir inmediatamente esas decisiones de vuelta en ChatGPT sin copiar/pegar, manteniendo el enlace web como respaldo verificable."
        }
      ],
      "allowOther": false,
      "allowNote": true
    }
  ]
}
